{
  "schema_version": "durable_evidence_manifest.v1",
  "case_id": "event-card-large-portrait-poster-8156-desktop",
  "contract_sha256": "dfc49a54ebd9a4d2d9da1f9c24321abf349714c62d3abf1dd00f71c1ce63ae1e",
  "pack_sha256": "e95d4a1c0649d35d4e11c4464ff00329ff38b9dd5c22573bbeb49d71a418a37a",
  "created_at": "2026-08-22T15:18:26.029Z",
  "retention_class": "current-v2-long-term",
  "total_bytes": 1507400,
  "files": [
    {
      "name": "astro.png",
      "sha256": "b1b75ae17b8019f2fea66465e10b06f59705bfb0af2070bf87d99c7fd43ad1c6",
      "bytes": 315492
    },
    {
      "name": "penpot.png",
      "sha256": "f8c715aec4a750ec964986a6aee82857ac25baa0313669a24fd8ff38713cbaf0",
      "bytes": 394267
    },
    {
      "name": "overlay-50.png",
      "sha256": "1226378124695f5c6c6a7311cc331dfbe8ebfb756bbd3500a79cff6eec0721b5",
      "bytes": 382976
    },
    {
      "name": "diff.png",
      "sha256": "1e4bb473e2ede141f66edf327732aaa0af922febcf31362e85cda3afc42856b8",
      "bytes": 387556
    },
    {
      "name": "geometry.json",
      "sha256": "6b9c16d1b03d6706cf5ce26e916f341c3af93e5e3635e1fb542b1a9389368ac5",
      "bytes": 1044
    },
    {
      "name": "computed-style.json",
      "sha256": "de1914cc19602d9894851fe156932483782c4de0311a9289dbd074472917f8d9",
      "bytes": 19012
    },
    {
      "name": "structural-findings.json",
      "sha256": "893ae032981330f8bd3557ef1a0ba273c5979eb91373bb8391ec081b30ec62bb",
      "bytes": 965
    },
    {
      "name": "pixel-metrics.json",
      "sha256": "e66d648ab00df1a7de5a5a57d49a6f208d17702ffd8a5c817fb3d54c259d6cf2",
      "bytes": 644
    },
    {
      "name": "agent-review.json",
      "sha256": "28cad5a7ff24ec6f7669835247cfc35c35e743ea994ee5ee828d21ff5d49328b",
      "bytes": 1419
    },
    {
      "name": "final-receipt.json",
      "sha256": "06ff85232fb3b285bc918f282bf15440751afa27238b443421296974dad5e35f",
      "bytes": 1471
    },
    {
      "name": "run-manifest.json",
      "sha256": "9e36be10a8c997ac21c35f78822871798137bc82804e6fa8ff69a62e72e7b02b",
      "bytes": 2554
    }
  ],
  "pack_path": "e95d4a1c0649d35d4e11c4464ff00329ff38b9dd5c22573bbeb49d71a418a37a"
}
