{
  "schema_version": "durable_evidence_manifest.v1",
  "case_id": "event-card-large-multi-image-6628-desktop",
  "contract_sha256": "dfc49a54ebd9a4d2d9da1f9c24321abf349714c62d3abf1dd00f71c1ce63ae1e",
  "pack_sha256": "3021898904cb3e2bd44ea7c98ad298e9ebac3d16f6c6c98777283ad350b329b7",
  "created_at": "2026-08-22T15:18:25.531Z",
  "retention_class": "current-v2-long-term",
  "total_bytes": 1537001,
  "files": [
    {
      "name": "astro.png",
      "sha256": "aff480ee03b5b42bb77cc042ecfde2b5aee420e4d43d5b37c93433968b894ec2",
      "bytes": 334092
    },
    {
      "name": "penpot.png",
      "sha256": "373966d229f8823a1a08db2d30c2ba119c9b8794cc4ad26c6e01659d46372673",
      "bytes": 418693
    },
    {
      "name": "overlay-50.png",
      "sha256": "8b3e67f6d26e0d8ded38bffa2f6c6f693661ca9cf5bfb985741659db898e1a21",
      "bytes": 367569
    },
    {
      "name": "diff.png",
      "sha256": "de8876cbdfb8f7b5e8478ff6b9885df34d09a3af8bded03a1c1e09e9a211fee5",
      "bytes": 389651
    },
    {
      "name": "geometry.json",
      "sha256": "12b7f3b55bc50c0e6f6dd3097c52f621a24bb7995c8bab7dc513df2c6ad0323c",
      "bytes": 1040
    },
    {
      "name": "computed-style.json",
      "sha256": "55111a8d20ce473863a40b17e27901d27bba4f556c9040a52cfe73aa87855c7f",
      "bytes": 18927
    },
    {
      "name": "structural-findings.json",
      "sha256": "f985f2d0bed27db9dcb264d91b5c112b6626485b9cfe2321619c579814372baa",
      "bytes": 961
    },
    {
      "name": "pixel-metrics.json",
      "sha256": "e86848b1dba5cc67bd0107754f1f5e519960abe86826fd3da8b5af9e90d05e21",
      "bytes": 640
    },
    {
      "name": "agent-review.json",
      "sha256": "a654bdaac286f6826bc33099e374fb9e6481ac1436e6cbbfbf0851acc756a6cb",
      "bytes": 1415
    },
    {
      "name": "final-receipt.json",
      "sha256": "9c8cb201aa7651229928d3c585e36e96ad71cb300857e9aea824c0c05b29aa28",
      "bytes": 1467
    },
    {
      "name": "run-manifest.json",
      "sha256": "4476bd4544a79ada5b960d90fe228c101a34ac2fefa7775efb1faced099f1ee9",
      "bytes": 2546
    }
  ],
  "pack_path": "3021898904cb3e2bd44ea7c98ad298e9ebac3d16f6c6c98777283ad350b329b7"
}
