{
  "schema_version": "durable_evidence_manifest.v1",
  "case_id": "event-card-large-landscape-crop-safe-7906-desktop",
  "contract_sha256": "dfc49a54ebd9a4d2d9da1f9c24321abf349714c62d3abf1dd00f71c1ce63ae1e",
  "pack_sha256": "39a250aafd990507c1a846b7557aec5002c1fef2af96522ba36b57c92cce0ea8",
  "created_at": "2026-08-22T15:18:25.207Z",
  "retention_class": "current-v2-long-term",
  "total_bytes": 1201966,
  "files": [
    {
      "name": "astro.png",
      "sha256": "989d043ec8e28729b06ecdfed50e7932054444650ad9ba498bb014a1ae1a0e1c",
      "bytes": 261228
    },
    {
      "name": "penpot.png",
      "sha256": "8977f0915bcb72cb6dd65c8eb1c0f042c13a5322239bb43ffc35a5188d12ea04",
      "bytes": 303479
    },
    {
      "name": "overlay-50.png",
      "sha256": "1f21afffbb00ea53241ccd5006444a6b39d111c7d41f6983dfb2dfb5fd5c30db",
      "bytes": 309201
    },
    {
      "name": "diff.png",
      "sha256": "322a2c7e97bddee500c4abee232268f4d0d55850b4676b6ea1d8ab908937114e",
      "bytes": 299804
    },
    {
      "name": "geometry.json",
      "sha256": "40e63c7c03bac3ab2ce378db60b64c69d75ea5a5f1164bcea976ab4e0269e455",
      "bytes": 1048
    },
    {
      "name": "computed-style.json",
      "sha256": "214b6e57ff3fdda4ad73ca144b5856582c5c40871f78024368b1a428d7cca8a0",
      "bytes": 20129
    },
    {
      "name": "structural-findings.json",
      "sha256": "2046f55d676364b3a1cfdc17f4234ec24c6226ae56689a8ca9f90b4880273341",
      "bytes": 969
    },
    {
      "name": "pixel-metrics.json",
      "sha256": "56e137cec2a6d98240fa3fe4e41d1dc0c5c33e77917464880782305d8918b0f1",
      "bytes": 648
    },
    {
      "name": "agent-review.json",
      "sha256": "878cddb293773b0ffcd931cbd676fbfaca53d3bb29750d82d0364dd1f398915a",
      "bytes": 1423
    },
    {
      "name": "final-receipt.json",
      "sha256": "20dd77cb2373c7e35bc3fb006b75a2b386de08b5fd456c88b24424cbf5e83d77",
      "bytes": 1475
    },
    {
      "name": "run-manifest.json",
      "sha256": "1b4ea257f486076510c8943ff5a4cc7559e4165146a388b8f9ff9f1bab37a5d8",
      "bytes": 2562
    }
  ]
}
